text,category
"Boas-Vindas Novos Membros: Reunião de boas-vindas aos três neuen membros da equipe de desenvolvimento (Ana, Bruno, Carla). Cada membro da equipe se apresentou brevemente. Apresentamos a visão geral da empresa, a cultura da equipe e os projetos atuais. Designamos ""buddies"" para auxiliar na integração inicial de cada novo colega. Entregamos o kit de boas-vindas e revisamos o plano de onboarding das primeiras semanas.","Gestão de Equipe"
"Estrutura Equipe - Otimização: Discutimos a estrutura atual da equipe de produto e possíveis ajustes para maior eficiência e clareza de papéis. Avaliamos a divisão atual por funcionalidades versus uma possível divisão por jornadas de usuário. Analisamos os prós e contras de cada modelo. Decidimos manter a estrutura atual por enquanto, mas implementar reuniões de sincronização mais frequentes entre os Product Managers para melhorar o alinhamento.","Gestão de Equipe"
"Iniciativa Inovação - Papéis: Definimos papéis e responsabilidades claras para a nova iniciativa de inovação ""Ideas Hub"". Designamos um líder para a iniciativa, um comitê de avaliação de ideias e ""campeões"" de inovação em cada departamento para estimular a participação. Esclarecemos o fluxo de submissão, avaliação e seleção de ideias. O objetivo é criar um processo transparente e encorajador. Lançamento oficial previsto para o próximo mês.","Gestão de Equipe"
"Plano Desenvolvimento Individual (PDI): Sessão de trabalho com os gestores para alinhar a abordagem e o cronograma para a criação/revisão dos Planos de Desenvolvimento Individual (PDIs) de todos os membros da equipe. Reforçamos a importância de conversas focadas nas aspirações de carreira, GAPs de competência e planos de ação (treinamentos, mentorias, projetos desafiadores). O prazo para conclusão dos PDIs é o final do próximo mês.","Gestão de Equipe"
"Comunicação Interna - Melhorias: Brainstorming sobre formas de melhorar a comunicação interna entre os departamentos de Vendas, Marketing e Produto. Identificamos GAPs como falta de visibilidade sobre o roadmap de produto e feedback de clientes não chegando a todas as áreas. Sugestões incluíram newsletters internas, reuniões interdepartamentais regulares e um canal compartilhado no Slack. Priorizamos implementar as reuniões e o canal no Slack imediatamente.","Gestão de Equipe"
"Processo Recrutamento - Alinhamento: Alinhamos o processo de recrutamento para as três vagas em aberto na equipe de engenharia. Definimos as etapas (triagem, teste técnico, entrevista comportamental, entrevista com gestor), os responsáveis por cada etapa e os critérios de avaliação. Enfatizamos a importância de uma experiência positiva para o candidato. Revisamos a descrição das vagas para garantir clareza e atratividade.","Gestão de Equipe"
"Mentoria Juniores - Discussão: Discutimos a necessidade e a viabilidade de implementar um programa de mentoria formal para os membros mais juniores da equipe. Reconhecemos o valor para o desenvolvimento e retenção desses talentos. Avaliamos quem poderiam ser os mentores e qual seria a estrutura do programa (pareamento, frequência de encontros, temas). Decidimos iniciar um piloto com 3 pares mentor-mentorado no próximo trimestre.","Gestão de Equipe"
"Team Building & Integração: Planejamos as atividades de integração e team building para o próximo semestre. O objetivo é fortalecer o relacionamento e a colaboração na equipe, especialmente com o modelo híbrido de trabalho. Ideias incluíram um happy hour virtual, um almoço presencial (para quem puder/quiser) e um workshop sobre comunicação eficaz. Definimos um orçamento e responsáveis pela organização de cada atividade.","Gestão de Equipe"
"KPIs Equipe Suporte - Revisão: Revisamos os indicadores de performance (KPIs) da equipe de suporte técnico. Analisamos métricas como Tempo Médio de Atendimento (TMA), Resolução no Primeiro Contato (FCR) e CSAT pós-atendimento. Identificamos uma tendência de aumento no TMA. Investigamos as causas (complexidade dos casos, necessidade de mais treinamento) e definimos um plano de ação focado em capacitação sobre os problemas mais recorrentes.","Gestão de Equipe"
"Políticas Trabalho Remoto/Híbrido: Alinhamos e comunicamos as políticas atualizadas de trabalho remoto e híbrido para a equipe. Esclarecemos as expectativas sobre presença no escritório (dias definidos vs. flexível), ferramentas de comunicação, segurança da informação em home office e subsídios (se aplicável). Respondemos às dúvidas da equipe para garantir que todos entendam as diretrizes e se sintam suportados em qualquer modalidade.","Gestão de Equipe"
"Práticas Ágeis - Implementação: Discutimos a implementação de novas práticas ágeis na equipe, além do Scrum básico já utilizado. Avaliamos a adoção de retrospectivas mais estruturadas (e.g., Starfish) e a introdução de métricas de fluxo (e.g., Lead Time, Cycle Time) para identificar gargalos. Decidimos experimentar o formato Starfish na próxima retrospectiva e começar a coletar dados para as métricas de fluxo.","Gestão de Equipe"
"Colaboração Produto & Engenharia - Feedback: Sessão de feedback focada na colaboração entre as equipes de Produto e Engenharia. Ambas as equipes compartilharam suas perspectivas sobre o que funciona bem (e.g., clareza nas user stories) e o que pode melhorar (e.g., envolvimento da engenharia mais cedo no processo de descoberta). Acordamos em realizar sessões conjuntas de refinamento de backlog mais frequentes e incluir um engenheiro nas fases iniciais de design.","Gestão de Equipe"
"Calendário Reuniões Recorrentes: Definimos e otimizamos o calendário de reuniões recorrentes da equipe (dailies, planning, review, retrospectiva, etc.). O objetivo foi garantir que as reuniões sejam eficazes, tenham propósito claro e não consumam tempo excessivo. Ajustamos a duração de algumas cerimônias e cancelamos uma reunião que se tornou redundante. O novo calendário foi comunicado e agendado.","Gestão de Equipe"
"Necessidades Capacitação - Análise: Analisamos as necessidades de capacitação da equipe para os desafios tecnológicos e de mercado previstos para o próximo ano (e.g., novas linguagens de programação, técnicas de análise de dados, IA). Mapeamos as competências atuais versus as necessárias. Identificamos GAPs prioritários e discutimos opções de treinamento (cursos online, workshops internos, participação em conferências). O resultado alimentará o planejamento de treinamento e desenvolvimento.","Gestão de Equipe"
"Cliente X - Ajuste Cronograma/Relatório: Reunião com o gestor de projeto do Cliente X. Ele solicitou ajustes no cronograma do projeto devido a um atraso interno da parte deles na validação de requisitos. Concordamos em reavaliar o impacto e apresentar um cronograma revisado em 48h. Adicionalmente, o cliente pediu mais detalhes no relatório de progresso semanal, especificamente sobre os testes realizados. Comprometemo-nos a incluir essa seção a partir do próximo relatório.","Reuniões com Clientes"
"Cliente Y - Apresentação Proposta Valor: Apresentamos nossa proposta de valor detalhada para resolver os desafios de gestão de estoque do Cliente Y. Demonstramos como nossa solução pode otimizar o processo, reduzir custos e melhorar a precisão. Respondemos às perguntas técnicas e de implementação. O cliente pareceu interessado e solicitou uma proposta comercial formal, incluindo prazos e custos detalhados. Enviaremos a proposta até o final da semana.","Reuniões com Clientes"
"Cliente Z - Feedback Protótipo Interface: Sessão de coleta de feedback com o Cliente Z sobre o protótipo da nova interface do portal do cliente. O cliente navegou pelas telas principais e realizou tarefas simuladas. O feedback geral foi muito positivo sobre a usabilidade e o design moderno. Apontaram a necessidade de um acesso mais rápido à seção de faturas e sugeriram adicionar um dashboard inicial com KPIs chave. Incorporaremos essas sugestões na próxima iteração.","Reuniões com Clientes"
"Cliente W - Progresso Projeto & Expectativas: Apresentamos o relatório de progresso do projeto de implementação do CRM ao Cliente W. Mostramos os módulos já configurados e os próximos passos. Alinhamos as expectativas sobre o cronograma da fase de migração de dados, que é crítica. O cliente expressou preocupação sobre o engajamento de sua equipe no treinamento. Concordamos em realizar uma sessão extra de ""tira-dúvidas"" e fornecer materiais de apoio adicionais.","Reuniões com Clientes"
"Cliente V - Solicitação Funcionalidade Adicional: Discutimos a solicitação do Cliente V para adicionar uma funcionalidade de integração com o sistema de RH deles, que não estava no escopo original do projeto. Analisamos o impacto técnico e o esforço necessário. Explicamos que isso representaria um aditivo de escopo e custo. O cliente compreendeu e solicitou um orçamento formal para essa funcionalidade adicional, que será avaliada separadamente.","Reuniões com Clientes"
"Cliente U - Kick-off Novo Projeto: Realizamos a reunião de kick-off do novo projeto de desenvolvimento de aplicativo móvel com o Cliente U. Apresentamos a equipe do nosso lado, revisamos os objetivos do projeto, o escopo acordado, o cronograma macro e a metodologia de trabalho (Scrum). Definimos os canais de comunicação, a frequência das reuniões de acompanhamento e os principais pontos de contato de ambos os lados. Estabelecemos um bom alinhamento inicial.","Reuniões com Clientes"
"Cliente T - Demo Software & Treinamento: Conduzimos uma sessão de demonstração detalhada do software customizado para o Cliente T, seguida de um treinamento inicial para os usuários chave. Cobrimos as principais funcionalidades, fluxos de trabalho e configurações. Respondemos a diversas perguntas práticas. O cliente ficou satisfeito com a demonstração e agendamos sessões de treinamento adicionais para o restante da equipe deles na próxima semana.","Reuniões com Clientes"
"Cliente S - Revisão Trimestral Negócios (QBR): Realizamos a Revisão Trimestral de Negócios (QBR) com o Cliente S. Apresentamos os resultados de performance da nossa solução no último trimestre, destacando a economia gerada e os KPIs atingidos. Discutimos os planos futuros do cliente e como podemos continuar a agregar valor. Coletamos feedback sobre nosso serviço e identificamos uma oportunidade para oferecer um módulo adicional. Próximo passo: enviar proposta para o módulo.","Reuniões com Clientes"
"Cliente R - Preocupações Performance: Reunião convocada para tratar das preocupações levantadas pelo Cliente R sobre a performance da plataforma em horários de pico. Apresentamos nossa análise inicial, que indicou gargalos na infraestrutura de banco de dados sob carga elevada. Detalhamos o plano de ação que estamos implementando para otimizar as consultas e escalar os recursos. O cliente apreciou a transparência e concordamos em monitorar a performance de perto nas próximas semanas.","Reuniões com Clientes"
"Cliente Q - Alinhamento Requisitos Técnicos: Reunião técnica com a equipe de TI do Cliente Q para alinhar os requisitos detalhados para a integração entre nosso sistema e o ERP deles. Discutimos protocolos de comunicação (API REST), formatos de dados (JSON), autenticação e tratamento de erros. Esclarecemos todas as dúvidas técnicas de ambos os lados. Elaboramos um documento conjunto de especificação técnica da integração, que servirá como base para o desenvolvimento.","Reuniões com Clientes"
"Cliente P - Apresentação Final & Aprovação: Apresentamos o resultado final do projeto de consultoria de otimização de processos ao Cliente P. Demonstramos os fluxos redesenhados, os ganhos de eficiência estimados e o plano de implementação recomendado. Respondemos às últimas perguntas e obtivemos a aprovação formal do cliente sobre os entregáveis. Encerramos o projeto com sucesso e discutimos potenciais trabalhos futuros.","Reuniões com Clientes"
"Cliente O - Renovação Contrato: Discutimos os termos para a renovação do contrato anual de licença e suporte com o Cliente O. Apresentamos as novidades da plataforma lançadas no último ano e o roadmap futuro. Negociamos as condições comerciais para o próximo período, chegando a um acordo mutuamente satisfatório que inclui um pequeno ajuste de preço e a manutenção do nível de serviço atual. O cliente confirmou a intenção de renovar.","Reuniões com Clientes"
"Cliente N - Coleta Requisitos Customização: Sessão detalhada com o Cliente N para coletar os requisitos específicos para a customização do módulo de relatórios do nosso software. Mapeamos os campos de dados necessários, os layouts desejados, os filtros e as regras de negócio específicas. Utilizamos mockups para facilitar a visualização. Documentamos todos os requisitos e enviaremos para validação formal do cliente antes de iniciar o desenvolvimento.","Reuniões com Clientes"
"Cliente M - Reunião Acompanhamento Satisfação: Reunião de acompanhamento proativa com o Cliente M para verificar a satisfação com nosso serviço e identificar eventuais necessidades não atendidas. O cliente reportou estar satisfeito com a plataforma, mas mencionou dificuldades em treinar neuen usuários internos. Oferecemos acesso gratuito aos nossos webinars gravados e sugerimos uma sessão de ""refresh"" para a equipe deles, que foi bem recebida.","Reuniões com Clientes"
"Cliente L - Escopo & Orçamento Fase 2: Discutimos o escopo e o orçamento para a Fase 2 do projeto de implementação com o Cliente L. Revisamos os itens que foram definidos como ""Fase 2"" no planejamento inicial. Detalhamos as funcionalidades incluídas, o esforço estimado e a proposta de valor. O cliente solicitou alguns ajustes no escopo e pediu um prazo para análise interna da proposta orçamentária. Aguardaremos o retorno deles.","Reuniões com Clientes"
"Cliente K - Apresentação Estudo Caso: Apresentamos um estudo de caso de sucesso de outro cliente do mesmo setor do Cliente K, demonstrando resultados concretos obtidos com nossa solução (ROI, redução de tempo em tarefas, etc.). O objetivo foi reforçar o valor e inspirar o Cliente K a explorar funcionalidades mais avançadas da plataforma. A apresentação gerou interesse e agendamos uma reunião específica para discutir a aplicação desses casos no contexto deles.","Reuniões com Clientes"
"Cliente J - Resolução Pendências Técnicas: Reunião focada em resolver pendências técnicas reportadas pelo Cliente J na última semana, relacionadas à exportação de dados. Nossa equipe técnica apresentou a causa raiz do problema (um bug específico) e a solução implementada na última atualização de patch. Realizamos testes conjuntos confirmando que o problema foi resolvido. O cliente agradeceu a rápida resolução.","Reuniões com Clientes"
"Cliente I - Métricas Sucesso Projeto Conjunto: Definimos em conjunto com o Cliente I as métricas de sucesso (KPIs) para o projeto piloto que estamos desenvolvendo em parceria. Estabelecemos metas claras para adoção da ferramenta, feedback dos usuários piloto e impacto em um processo de negócio específico. Acordamos como os dados serão coletados e reportados. Este alinhamento é crucial para avaliar o sucesso do piloto e decidir sobre a expansão.","Reuniões com Clientes"
"Cliente H - Plano Comunicação Implantação: Alinhamos o plano de comunicação interna com o Cliente H para a fase de implantação do nosso software na empresa deles. Definimos as mensagens chave, os públicos (usuários finais, gestores), os canais (email, intranet, reuniões) e o cronograma das comunicações. O objetivo é garantir uma transição suave, gerenciar expectativas e promover a adoção da nova ferramenta.","Reuniões com Clientes"
"Cliente G - Coleta Depoimento Marketing: Reunião com o Cliente G, um usuário satisfeito e de longa data, para solicitar um depoimento sobre sua experiência com nosso produto/serviço para usarmos em materiais de marketing. Explicamos como seria utilizado e o processo (gravação curta ou texto). O cliente concordou entusiasticamente e agendamos uma breve sessão na próxima semana para coletar o depoimento.","Reuniões com Clientes"
"Brainstorming Novas Ideias Produtos 2025: Sessão de brainstorming interdepartamental para gerar novas ideias de produtos e serviços para o roadmap de 2025. Utilizamos técnicas como ""How Might We"" para explorar oportunidades em áreas como IA, sustentabilidade e experiência do cliente. Geramos mais de 50 ideias iniciais, que foram agrupadas por temas. Próximo passo: refinar e priorizar as ideias mais promissoras com base em critérios estratégicos.","Outras"
"Planejamento Estratégico Ano Fiscal: Reunião de liderança para dar início ao planejamento estratégico do próximo ano fiscal. Revisamos a visão e missão da empresa, analisamos o cenário de mercado (SWOT) e discutimos as prioridades estratégicas de alto nível (e.g., crescimento em novo segmento, melhoria da eficiência operacional, inovação). Definimos os próximos passos do processo de planejamento, que envolverá todas as áreas da empresa.","Outras"
"Workshop Metodologias Ágeis: Workshop interno para aprofundar o conhecimento da equipe sobre metodologias ágeis, com foco em Kanban e Lean. Cobrimos os princípios, as práticas e as métricas chave. Realizamos exercícios práticos para simular o fluxo de trabalho e a identificação de gargalos. O objetivo foi capacitar as equipes a escolherem e aplicarem as práticas mais adequadas ao seu contexto, além do Scrum básico.","Outras"
"Otimização Processo Aprovação Despesas: Reunião do grupo de trabalho focado em otimizar o processo interno de aprovação de despesas. Mapeamos o fluxo atual, identificamos gargalos (múltiplas aprovações manuais, falta de clareza nas políticas) e brainstormamos soluções. As propostas incluem a implementação de uma ferramenta digital, a revisão das alçadas de aprovação e a simplificação das políticas. Um plano piloto será desenhado.","Outras"
"Alinhamento Jurídico Novas Regulamentações: Reunião entre as equipes de Produto, Engenharia e Jurídico para discutir o impacto de novas regulamentações de privacidade de dados (LGPD/GDPR updates) em nossos produtos e processos. O jurídico apresentou as principais mudanças e exigências. Avaliamos quais áreas do nosso sistema e quais políticas internas precisam de ajuste. Criamos um plano de ação com responsáveis e prazos para garantir a conformidade.","Outras"
"Resultados Empresa Q2 - Apresentação Geral: Apresentação geral para todos os colaboradores sobre os resultados financeiros e operacionais da empresa no último trimestre (Q2). A diretoria compartilhou os destaques (crescimento de receita, lançamento de produto X), os desafios (aumento da concorrência) e as prioridades para o Q3. Houve espaço para perguntas e respostas, reforçando a transparência na comunicação interna.","Outras"
"Reunião Parceria Estratégica Potencial: Primeira reunião com a Empresa Y, um potencial parceiro estratégico, para discutir sinergias e oportunidades de colaboração. Apresentamos nossas respectivas empresas e exploramos áreas de interesse mútuo, como integração de produtos, co-marketing ou vendas conjuntas. Identificamos algumas possibilidades promissoras. Concordamos em agendar reuniões de acompanhamento mais focadas em áreas específicas.","Outras"
"Implementação Nova Ferramenta CRM: Reunião do comitê de implementação da nova ferramenta de CRM (Salesforce). Revisamos o status do projeto: configuração básica concluída, migração de dados em andamento, plano de treinamento definido. Discutimos os próximos passos críticos, como os testes de integração e o treinamento dos usuários finais. Confirmamos a data de go-live e o plano de suporte pós-implementação.","Outras"
"Políticas Segurança Informação - Revisão: Reunião do comitê de segurança da informação para revisar e atualizar as políticas internas. Focamos em políticas relacionadas a acesso remoto seguro, uso de dispositivos pessoais (BYOD) e resposta a incidentes. Incorporamos melhores práticas de mercado e feedback de auditorias recentes. As políticas atualizadas serão comunicadas a todos os colaboradores e incluídas no treinamento de onboarding.","Outras"
"Alinhamento Lançamento Novo Serviço: Reunião interdepartamental (Marketing, Vendas, Produto, Suporte, Financeiro) para alinhar todos os aspectos do lançamento do novo serviço de consultoria. Revisamos o plano de marketing, a estratégia de precificação, o processo de vendas, a capacidade de entrega da equipe e os fluxos de faturamento e suporte. Garantimos que todas as áreas estão preparadas e coordenadas para o lançamento na próxima semana.","Outras"
"Reunião Fornecedor Infraestrutura: Reunião com nosso principal fornecedor de infraestrutura em nuvem (AWS/Azure/GCP). Discutimos a performance recente dos serviços contratados, os custos e as oportunidades de otimização. Apresentamos nossas projeções de crescimento de uso para o próximo ano. Negociamos possíveis descontos por volume ou por compromisso de uso a longo prazo. Avaliamos também novos serviços oferecidos pelo fornecedor.","Outras"
"Planejamento Participação Feira Setor: Reunião da equipe de marketing e vendas para planejar a participação da empresa na principal feira do setor no próximo semestre. Definimos os objetivos (geração de leads, fortalecimento da marca), o tamanho e design do stand, as demonstrações de produto a serem realizadas, os materiais de marketing necessários e a equipe que estará presente. Estabelecemos um orçamento e um cronograma detalhado.","Outras"
"Iniciativas Sustentabilidade & RSC: Discussão sobre as iniciativas de sustentabilidade e responsabilidade social corporativa (RSC) da empresa. Revisamos as ações atuais (reciclagem, voluntariado) e brainstormamos novas ideias alinhadas aos valores da empresa e às expectativas dos stakeholders. Priorizamos focar na redução da pegada de carbono das nossas operações e no apoio a um projeto social local. Criamos um grupo de trabalho para detalhar essas iniciativas.","Outras"
"Plano Continuidade Negócios - Revisão: Revisão anual do Plano de Continuidade de Negócios (PCN). Analisamos os cenários de desastre considerados (falha de data center, pandemia, ataque cibernético), as estratégias de recuperação, os tempos de objetivo de recuperação (RTO/RPO) e os procedimentos de comunicação de crise. Identificamos a necessidade de atualizar a lista de contatos chave e realizar um teste simulado no próximo trimestre.","Outras"
"Melhorias Employee Experience - Brainstorming: Sessão de brainstorming com representantes de diversas áreas e o RH para gerar ideias sobre como melhorar a experiência do colaborador (employee experience). Discutimos pontos como onboarding, desenvolvimento de carreira, reconhecimento, bem-estar e ambiente de trabalho. Coletamos sugestões práticas e de baixo custo, bem como ideias mais ambiciosas. O RH consolidará as ideias e apresentará propostas à diretoria.","Outras"